timestamp,tweet_text,username,all_hashtags,followers_count2020-04-23 17:49:37,"b'@dazeykins @elliegirl532 @worldofchanxes Yes exactly. -to reply to both of your responses- I agree!!! They take everything Demi says as \xe2\x80\x9cshade\xe2\x80\x9d toward Selena and Taylor when it\xe2\x80\x99s not even close. Some even stoop so low that they make fun of her mental illness, eating disorder and drug addiction. Which is disgusting.'",b'CattIsANerd',[],510
2020-04-23 17:41:11,"b'There\xe2\x80\x99s nothing wrong with saying   \xe2\x80\x9cHey, young gays appear to be making Onlyfans accounts at an alarming rate. This trend should be monitored for a demographic already at high risk of mental illness, homelessness, and drug abuse\xe2\x80\x9d'",b'firesignwoes',[],1554
2020-04-23 15:34:13,"b'@NRA Hmmm....add the recipe of mental illness, drug or alcohol addiction, depression,spouse leaving, losing job, loss of family and being alone (pick one) and feeling hopeless...you may want to harm yourself or others...in which case, should you be walking around all day with a gun??'",b'hnewhnew',[],79
2020-04-23 15:05:15,"b'@roIIingstcnes as in kurt cobian? like deadass, kurt ended his own life out of like a combination of stress, mental illness and drug abuse. people who bring up kurt in order to affirm their own bigotry are so gross. kurt was literally a massive advocate for the LGBTQ/women rights!.'",b'britpopslut',[],408
2020-04-23 13:53:36,b'@piersmorgan Yep! If this were a war with guns and tanks they would do it. They should also go into the homes of the people who are dealing with mental illness and drug addiction and see what their TDS lies and data manipulations are doing to those ppl.  Their lives matter too.',b'MissGracieCat2U',[],919
2020-04-23 13:48:44,b'@snowkitty19891 @NEWS1130 Agree but vast majority of the mental illness are the result of the drug and alcohol addiction. No doubt! Leaving the addicts to clean themselves is not working. Most of them are unemployable now.  Sad but true.',b'DDeleet',[],16
2020-04-23 13:15:09,b'@ZR1Trader And I definitely know more about mental illness than Peter Theil and drug pushing psychiatrists',b'M7ammad5awaja',[],85
2020-04-23 12:45:49,"b'@EllenBarkin This is why people laugh at clowns like you. When a shit for  brains actress comes forth with an outrageous statement - the evidence points to sever mental illness, drug and alcohol abuse or a serious genetic disorder. Stick to what you do best - inmate the world around you-'",b'native_wetase',[],35
2020-04-23 12:40:16,"b""@bigalchitown @RacySicilian @go4itbas This is how people excuse bad behavior. Mental illness. Then let's go ahead and drug the kid up so that as an adult, we have yet another druggie or worse a kid that kills himself as a side effect from these drugs. OR how bout you just whoop his butt and hold him accountable?""",b'Kellyann962',[],1513
2020-04-23 11:00:24,"b'@mikeandersonsr The exponential toll in suicide, stress related/ alcohol/drug/deaths, murders, increased mental illness, and on and on not to mention homelessness &amp; hopelessness emphasizes "" poorly conceived"" but I would add unneccesary and suspect'",b'FrankBrun1',[],10013
2020-04-23 06:33:57,b'Welcome to PH! where drug lords and corrupt politicians get to enjoy their lives full of wealth but a man that has mental illness roaming around without a piece of paper is murdered. #JusticeForWinstonRagos',b'JoachimMihcaoj',['JusticeForWinstonRagos'],128
2020-04-23 04:50:31,b'@GrifBruh @taraewatkins @creepshow2020 @freakmommy then my apologies. Your og comment rly reads like \xe2\x80\x9cppl with unknown tendencies towards mental illness don\xe2\x80\x99t count\xe2\x80\x9d and that upset me bc those are the people who are the most hurt by drug abuse.',b'apbeeZah',[],143
2020-04-23 04:42:03,"b'@Greenideblonde2 @ImAResistor @Trump_Detester Dilated pupils, flat affect, rambling and incoherent speech patterns; all signs of either drug intoxication, mental illness, or status post CVA.'",b'HeatherHeitman2',[],34
2020-04-23 03:18:34,"b'@mamendoza480 Mental illness will be the back door to Dems taking away 2ndA rights. Take any prescribed drug that ""may alter"" emotions and you will be put on the no gun list. As well as everyone that lives in the same house.   Sneaky bastards they are.'",b'Glenburns3',[],1706
2020-04-23 01:41:20,b'Issa difference between Mental Illness and drug addiction. Mfs be perfectly fine then get on drugs and have all these issues. Y\xe2\x80\x99all jus giving drug addicts excuses at that point. Know the difference before you label one with a so called mental illness.',b'espn_seb',[],21
2020-04-23 01:28:22,b'@citykoh @NewNaratif man the number of \xe2\x80\x9cdemocrats\xe2\x80\x9d in hawaii who wanna gleefully champion singaporian solutions to social services challenges like mental illness and drug addiction among our homeless population...',b'BikeRacket',[],672
2020-04-23 00:52:22,"b'@rlamartini @DrDenaGrayson @DrKCain @realDonaldTrump @FT @jburnmurdoch You are too stupid to be a doctor, or maybe you have dementia or a mental illness like Trump... he continually lies, says whatever nonsense comes into his head and says things Birx and Fauci have to correct or cover for. Oh yea ... and pushed a drug that is not proven to work.'",b'DPleis',[],291
timestamp,tweet_text,username,all_hashtags,followers_count
